{
  "accepted": {
    "email": "yangchgang@zuel.edu.cn",
    "mentor_status": "active",
    "name": "杨光",
    "organization_id": "org_auto_56c317308e1ae449045e",
    "profile_url": "http://xagx.zuel.edu.cn/2016/0918/c3560a78997/page.htm",
    "recent_papers": [
      "Guang Yang, Haibo He and Qian Chen, Emotion-Semantic-Enhanced Neural Network, IEEE/ACM Transactions on Audio, Speech, and Language Processing, 2019, 27(3), pp. 531-543.",
      "Lusi. Li, Haibo He, Jie. Li and Guang Yang, Adversarial Domain Adaptation via Category Transfer, 2019 International Joint Conference on Neural Networks(IJCNN), Budapest, Hungary, 2019, pp. 1-8, doi: 10.1109/IJCNN.2019.8851925.",
      "Guang Yang, Xiaohua Gu, Fault Diagnosis of Complex Chemical Processes Based on Enhanced Naive Bayesian Method, IEEE Transactions on Instrumentation and Measurement, 2020, 69(7), pp. 4649-4658.",
      "Guang Yang, Yanli Zhao, Xiaohua Gu, A Novel Bayesian Framework With Enhanced Principal Component Analysis for Chemical Fault Diagnosis, IEEE Transactions on Instrumentation and Measurement, 2021, 70, doi: 10.1109/TIM.2020.3034975.",
      "Xiaohua Gu, Yanli Zhao, Guang Yang*( Corresponding author), and Lusi Li, An Imbalance Modified Convolutional Neural Network With Incremental Learning for Chemical Fault Diagnosis, IEEE Transactions on Industrial Informatics, 2021, DOI: 10.1109/TII.2021.3112988.",
      "Zhao, Yanli, and Guang Yang. \"Deep Learning-based Integrated Framework for stock price movement prediction.\" Applied Soft Computing 133 (2023): 109921.",
      "Gu, Xiaohua and Lu, Fei and Yang, Liping and Wang, Kan and Li, Lusi and Yang, Guang and Sun, Yiling. “Structure information preserving domain adaptation network for fault diagnosis of Sucker Rod Pumping systems.” Neural Networks, 188(2025): 107392."
    ],
    "research_directions": [
      "工业设备故障诊断、反洗钱"
    ],
    "source_url": "https://xagx.zuel.edu.cn/3349/list.htm",
    "submitted_department": "计算机科学与技术系",
    "submitted_school": "信息工程学院",
    "submitted_university": "中南财经政法大学",
    "title": "副教授"
  },
  "contributor": {
    "account_age_days_at_submission": 1530,
    "account_created_at": "2022-06-13T08:30:46Z",
    "github_login_at_submission": "JunieXD",
    "github_user_id": 107397009,
    "github_user_type": "User",
    "issue_number": 188,
    "issue_url": "https://github.com/JunieXD/AutoEmailSender-MentorData/issues/188",
    "submitted_at": "2026-08-21T18:54:52Z"
  },
  "evidence": [
    {
      "fields": [
        "name",
        "email",
        "organization_id",
        "title",
        "research_directions",
        "recent_papers",
        "profile_url"
      ],
      "observed_at": "2026-08-21T18:54:52Z",
      "source_url": "http://xagx.zuel.edu.cn/2016/0918/c3560a78997/page.htm"
    }
  ],
  "id": "claim_81703afb07cc05cc71d7",
  "mentor_id": "mentor_bdc36039b12e6320271c",
  "moderation": {
    "decision_at": "2026-08-22T10:50:17Z",
    "mode": "manual",
    "moderator_github_user_id": 107397009,
    "normalized_fields": [
      "organization_id"
    ],
    "policy_version": 1,
    "reason": "GitHub PR merge approval"
  },
  "revocation_reason": null,
  "revoked_at": null,
  "schema_version": 1,
  "status": "accepted",
  "submitted": {
    "email": "yangchgang@zuel.edu.cn",
    "mentor_status": "active",
    "name": "杨光",
    "organization_id": null,
    "profile_url": "http://xagx.zuel.edu.cn/2016/0918/c3560a78997/page.htm",
    "recent_papers": [
      "Guang Yang, Haibo He and Qian Chen, Emotion-Semantic-Enhanced Neural Network, IEEE/ACM Transactions on Audio, Speech, and Language Processing, 2019, 27(3), pp. 531-543.",
      "Lusi. Li, Haibo He, Jie. Li and Guang Yang, Adversarial Domain Adaptation via Category Transfer, 2019 International Joint Conference on Neural Networks(IJCNN), Budapest, Hungary, 2019, pp. 1-8, doi: 10.1109/IJCNN.2019.8851925.",
      "Guang Yang, Xiaohua Gu, Fault Diagnosis of Complex Chemical Processes Based on Enhanced Naive Bayesian Method, IEEE Transactions on Instrumentation and Measurement, 2020, 69(7), pp. 4649-4658.",
      "Guang Yang, Yanli Zhao, Xiaohua Gu, A Novel Bayesian Framework With Enhanced Principal Component Analysis for Chemical Fault Diagnosis, IEEE Transactions on Instrumentation and Measurement, 2021, 70, doi: 10.1109/TIM.2020.3034975.",
      "Xiaohua Gu, Yanli Zhao, Guang Yang*( Corresponding author), and Lusi Li, An Imbalance Modified Convolutional Neural Network With Incremental Learning for Chemical Fault Diagnosis, IEEE Transactions on Industrial Informatics, 2021, DOI: 10.1109/TII.2021.3112988.",
      "Zhao, Yanli, and Guang Yang. \"Deep Learning-based Integrated Framework for stock price movement prediction.\" Applied Soft Computing 133 (2023): 109921.",
      "Gu, Xiaohua and Lu, Fei and Yang, Liping and Wang, Kan and Li, Lusi and Yang, Guang and Sun, Yiling. “Structure information preserving domain adaptation network for fault diagnosis of Sucker Rod Pumping systems.” Neural Networks, 188(2025): 107392."
    ],
    "research_directions": [
      "工业设备故障诊断、反洗钱"
    ],
    "source_url": "https://xagx.zuel.edu.cn/3349/list.htm",
    "submitted_department": "计算机科学与技术系",
    "submitted_school": "信息工程学院",
    "submitted_university": "中南财经政法大学",
    "title": "副教授"
  }
}
