{
  "accepted": {
    "email": "shiqiang.nie@xjtu.edu.cn",
    "mentor_status": "active",
    "name": "聂世强",
    "organization_id": "org_auto_23701349c5111638af4c",
    "profile_url": "https://gr.xjtu.edu.cn/en/web/shiqiang",
    "recent_papers": [],
    "research_directions": [
      "新型非易失性存储介质性能和可靠性优化研究、分布式和单机存储系统性能优化研究"
    ],
    "source_url": "http://www.cs.xjtu.edu.cn/szdw/jsml/fjs1.htm",
    "submitted_department": "计算机科学与技术学院",
    "submitted_school": "计算机科学与技术学院",
    "submitted_university": "西安交通大学",
    "title": "副研究员"
  },
  "contributor": {
    "account_age_days_at_submission": 1527,
    "account_created_at": "2022-06-13T08:30:46Z",
    "github_login_at_submission": "JunieXD",
    "github_user_id": 107397009,
    "github_user_type": "User",
    "issue_number": 92,
    "issue_url": "https://github.com/JunieXD/AutoEmailSender-MentorData/issues/92",
    "submitted_at": "2026-08-19T06:58:50Z"
  },
  "evidence": [
    {
      "fields": [
        "name",
        "email",
        "organization_id",
        "title",
        "research_directions",
        "profile_url"
      ],
      "observed_at": "2026-08-19T06:58:50Z",
      "source_url": "https://gr.xjtu.edu.cn/en/web/shiqiang"
    }
  ],
  "id": "claim_3bf2a17d45fa136f37af",
  "mentor_id": "mentor_c2b6d4fe47792b9eb22a",
  "moderation": {
    "decision_at": "2026-08-19T07:30:46Z",
    "mode": "manual",
    "moderator_github_user_id": 107397009,
    "normalized_fields": [
      "organization_id"
    ],
    "policy_version": 1,
    "reason": "GitHub PR merge approval"
  },
  "revocation_reason": null,
  "revoked_at": null,
  "schema_version": 1,
  "status": "accepted",
  "submitted": {
    "email": "shiqiang.nie@xjtu.edu.cn",
    "mentor_status": "active",
    "name": "聂世强",
    "organization_id": null,
    "profile_url": "https://gr.xjtu.edu.cn/en/web/shiqiang",
    "recent_papers": [],
    "research_directions": [
      "新型非易失性存储介质性能和可靠性优化研究、分布式和单机存储系统性能优化研究"
    ],
    "source_url": "http://www.cs.xjtu.edu.cn/szdw/jsml/fjs1.htm",
    "submitted_department": "计算机科学与技术学院",
    "submitted_school": "计算机科学与技术学院",
    "submitted_university": "西安交通大学",
    "title": "副研究员"
  }
}
