{
  "accepted": {
    "email": "qzhu@bjtu.edu.cn",
    "mentor_status": "active",
    "name": "诸强",
    "organization_id": "org_auto_a33d6bd5e5916952d3de",
    "profile_url": null,
    "recent_papers": [],
    "research_directions": [
      "人工智能",
      "数据与知识工程",
      "机器学习与认知计算"
    ],
    "source_url": "https://faculty.bjtu.edu.cn/7656/",
    "submitted_department": "人工智能系",
    "submitted_school": "计算机科学与技术学院",
    "submitted_university": "北京交通大学",
    "title": "副教授"
  },
  "contributor": {
    "account_age_days_at_submission": 995,
    "account_created_at": "2023-11-18T13:25:32Z",
    "github_login_at_submission": "2023ljd",
    "github_user_id": 151378479,
    "github_user_type": "User",
    "issue_number": 30,
    "issue_url": "https://github.com/JunieXD/AutoEmailSender-MentorData/issues/30",
    "submitted_at": "2026-08-10T07:30:52Z"
  },
  "evidence": [
    {
      "fields": [
        "name",
        "email",
        "organization_id",
        "title",
        "research_directions"
      ],
      "observed_at": "2026-08-10T07:30:52Z",
      "source_url": "https://faculty.bjtu.edu.cn/7656/"
    }
  ],
  "id": "claim_b3a97b76b8647022919c",
  "mentor_id": "mentor_06390af158497f289ce6",
  "moderation": {
    "decision_at": "2026-08-10T13:53:35Z",
    "mode": "manual",
    "moderator_github_user_id": 107397009,
    "normalized_fields": [],
    "policy_version": 1,
    "reason": "GitHub PR merge approval"
  },
  "revocation_reason": null,
  "revoked_at": null,
  "schema_version": 1,
  "status": "accepted",
  "submitted": {
    "email": "qzhu@bjtu.edu.cn",
    "mentor_status": "active",
    "name": "诸强",
    "organization_id": "org_auto_a33d6bd5e5916952d3de",
    "profile_url": null,
    "recent_papers": [],
    "research_directions": [
      "人工智能",
      "数据与知识工程",
      "机器学习与认知计算"
    ],
    "source_url": "https://faculty.bjtu.edu.cn/7656/",
    "submitted_department": "人工智能系",
    "submitted_school": "计算机科学与技术学院",
    "submitted_university": "北京交通大学",
    "title": "副教授"
  }
}
