{
  "accepted": {
    "email": "xhchen@sei.ecnu.edu.cn",
    "mentor_status": "active",
    "name": "陈小红",
    "organization_id": "org_auto_bef3df0765bc90939f42",
    "profile_url": "https://faculty.ecnu.edu.cn/_s43/cxh2/main.psp",
    "recent_papers": [
      "Zhujun Wu, Xiaohong Chen*, Zhi Jin*, Ming Hu, Dongming Jin. Unlocking the Silent Needs: Business-Logic-Driven Iterative Requirements Auto-completion. ICSE, accepted",
      "Yue Fang, Zhi Jin*, Jie An*, Hongshen Chen, Xiaohong Chen, Naijun Zhan. RESTL: Reinforcement Learning Guided by Multi-Aspect Rewards for Signal Temporal Logic Transformation. AAAI 2026",
      "Yike Huang, Ming Hu, Xiaohong Chen*, Zhi Jin*, Shuyuan Xiao. Modeling Like Peeling an Onion: Layerwise Analysis-Driven Automatic Behavioral Model Generation. ICSE, accepted",
      "Xiaohong Chen, Shi Chen, Zhi Jin, Zihan Chen, Mingsong Chen. What You See Is What You Get: Prototype Generation for IoT End-User Programming. IEEE Trans. Software Eng. 51(7): 1996-2014 (2025)",
      "陈小红,刘少彬,金芝. 嵌入式系统的需求描述综述. 软件学报, 2025, 36(1): 27-46",
      "Tong Xu, Zheng Zhou, Xiaohong Chen, Zhiyi Xue, Yi Zhao, Min Zhang, Zhi Jin. Requirements Dependency Driven Test Case Generation: An Automotive Industry Practice. RE 2025: 400-404",
      "Yue Fang, Zhi Jin, Jie An, Hongshen Chen, Xiaohong Chen, Naijun Zhan. Enhancing Transformation from Natural Language to Signal Temporal Logic Using LLMs with Diverse External Knowledge. ACL (Findings) 2025: 10446-10458",
      "Zhiyi Xue, Liangguo Li, Senyue Tian, Xiaohong Chen*, Pingping Li, Liangyu Chen, Tingliang Jiang, Min Zhang. LLM4Fin: Fully Automating LLM-Powered Test Case Generation for FinTech Software Acceptance Testing. ISSTA 2024: 1643-1655"
    ],
    "research_directions": [
      "大模型时代最有用的方向:智能化需求工程与软件工程,关键词包括需求工程、知识工程、形式化方法、AI、本体、智能体,具体涵盖AI4RE、RE4AI、基于AI的软件自动生成技术、需求变更驱动的软件演化智能体、领域知识本体自动构建方向"
    ],
    "source_url": "https://sei.ecnu.edu.cn/33189/list.htm",
    "submitted_department": "软件工程学院",
    "submitted_school": "软件工程学院",
    "submitted_university": "华东师范大学",
    "title": "教授"
  },
  "contributor": {
    "account_age_days_at_submission": 1520,
    "account_created_at": "2022-06-13T08:30:46Z",
    "github_login_at_submission": "JunieXD",
    "github_user_id": 107397009,
    "github_user_type": "User",
    "issue_number": 51,
    "issue_url": "https://github.com/JunieXD/AutoEmailSender-MentorData/issues/51",
    "submitted_at": "2026-08-11T13:32:42Z"
  },
  "evidence": [
    {
      "fields": [
        "name",
        "email",
        "organization_id",
        "title",
        "research_directions",
        "recent_papers",
        "profile_url"
      ],
      "observed_at": "2026-08-11T13:32:42Z",
      "source_url": "https://faculty.ecnu.edu.cn/_s43/cxh2/main.psp"
    }
  ],
  "id": "claim_985020c979b96ce5b567",
  "mentor_id": "mentor_fd7311e88543bef0d62c",
  "moderation": {
    "decision_at": "2026-08-13T02:36:14Z",
    "mode": "manual",
    "moderator_github_user_id": 107397009,
    "normalized_fields": [
      "organization_id"
    ],
    "policy_version": 1,
    "reason": "GitHub PR merge approval"
  },
  "revocation_reason": null,
  "revoked_at": null,
  "schema_version": 1,
  "status": "accepted",
  "submitted": {
    "email": "xhchen@sei.ecnu.edu.cn",
    "mentor_status": "active",
    "name": "陈小红",
    "organization_id": null,
    "profile_url": "https://faculty.ecnu.edu.cn/_s43/cxh2/main.psp",
    "recent_papers": [
      "Zhujun Wu, Xiaohong Chen*, Zhi Jin*, Ming Hu, Dongming Jin. Unlocking the Silent Needs: Business-Logic-Driven Iterative Requirements Auto-completion. ICSE, accepted",
      "Yue Fang, Zhi Jin*, Jie An*, Hongshen Chen, Xiaohong Chen, Naijun Zhan. RESTL: Reinforcement Learning Guided by Multi-Aspect Rewards for Signal Temporal Logic Transformation. AAAI 2026",
      "Yike Huang, Ming Hu, Xiaohong Chen*, Zhi Jin*, Shuyuan Xiao. Modeling Like Peeling an Onion: Layerwise Analysis-Driven Automatic Behavioral Model Generation. ICSE, accepted",
      "Xiaohong Chen, Shi Chen, Zhi Jin, Zihan Chen, Mingsong Chen. What You See Is What You Get: Prototype Generation for IoT End-User Programming. IEEE Trans. Software Eng. 51(7): 1996-2014 (2025)",
      "陈小红,刘少彬,金芝. 嵌入式系统的需求描述综述. 软件学报, 2025, 36(1): 27-46",
      "Tong Xu, Zheng Zhou, Xiaohong Chen, Zhiyi Xue, Yi Zhao, Min Zhang, Zhi Jin. Requirements Dependency Driven Test Case Generation: An Automotive Industry Practice. RE 2025: 400-404",
      "Yue Fang, Zhi Jin, Jie An, Hongshen Chen, Xiaohong Chen, Naijun Zhan. Enhancing Transformation from Natural Language to Signal Temporal Logic Using LLMs with Diverse External Knowledge. ACL (Findings) 2025: 10446-10458",
      "Zhiyi Xue, Liangguo Li, Senyue Tian, Xiaohong Chen*, Pingping Li, Liangyu Chen, Tingliang Jiang, Min Zhang. LLM4Fin: Fully Automating LLM-Powered Test Case Generation for FinTech Software Acceptance Testing. ISSTA 2024: 1643-1655"
    ],
    "research_directions": [
      "大模型时代最有用的方向:智能化需求工程与软件工程,关键词包括需求工程、知识工程、形式化方法、AI、本体、智能体,具体涵盖AI4RE、RE4AI、基于AI的软件自动生成技术、需求变更驱动的软件演化智能体、领域知识本体自动构建方向"
    ],
    "source_url": "https://sei.ecnu.edu.cn/33189/list.htm",
    "submitted_department": "软件工程学院",
    "submitted_school": "软件工程学院",
    "submitted_university": "华东师范大学",
    "title": "教授"
  }
}
