{
  "accepted": {
    "email": "zhangxun_hit@sina.com",
    "mentor_status": "active",
    "name": "张勋",
    "organization_id": "org_auto_d37c3b5e36685c0001ae",
    "profile_url": "https://faculty.hrbeu.edu.cn/zhangxun/zh_CN/index.htm",
    "recent_papers": [],
    "research_directions": [
      "水下无人系统控制、高超声速飞行器控制、图像处理和数据挖掘等"
    ],
    "source_url": "http://cisse.hrbeu.edu.cn/szdw/bsds.htm",
    "submitted_department": "智能科学与工程学院",
    "submitted_school": "智能科学与工程学院",
    "submitted_university": "哈尔滨工程大学",
    "title": "教授"
  },
  "contributor": {
    "account_age_days_at_submission": 1530,
    "account_created_at": "2022-06-13T08:30:46Z",
    "github_login_at_submission": "JunieXD",
    "github_user_id": 107397009,
    "github_user_type": "User",
    "issue_number": 124,
    "issue_url": "https://github.com/JunieXD/AutoEmailSender-MentorData/issues/124",
    "submitted_at": "2026-08-21T18:47:56Z"
  },
  "evidence": [
    {
      "fields": [
        "name",
        "email",
        "organization_id",
        "title",
        "research_directions",
        "profile_url"
      ],
      "observed_at": "2026-08-21T18:47:56Z",
      "source_url": "https://faculty.hrbeu.edu.cn/zhangxun/zh_CN/index.htm"
    }
  ],
  "id": "claim_ebcefbe12a428e63ab21",
  "mentor_id": "mentor_d3e064f95cac96919037",
  "moderation": {
    "decision_at": "2026-08-22T09:02:43Z",
    "mode": "manual",
    "moderator_github_user_id": 107397009,
    "normalized_fields": [
      "organization_id"
    ],
    "policy_version": 1,
    "reason": "GitHub PR merge approval"
  },
  "revocation_reason": null,
  "revoked_at": null,
  "schema_version": 1,
  "status": "accepted",
  "submitted": {
    "email": "zhangxun_hit@sina.com",
    "mentor_status": "active",
    "name": "张勋",
    "organization_id": null,
    "profile_url": "https://faculty.hrbeu.edu.cn/zhangxun/zh_CN/index.htm",
    "recent_papers": [],
    "research_directions": [
      "水下无人系统控制、高超声速飞行器控制、图像处理和数据挖掘等"
    ],
    "source_url": "http://cisse.hrbeu.edu.cn/szdw/bsds.htm",
    "submitted_department": "智能科学与工程学院",
    "submitted_school": "智能科学与工程学院",
    "submitted_university": "哈尔滨工程大学",
    "title": "教授"
  }
}
