{
  "accepted": {
    "email": "guoshn@bjtu.edu.cn",
    "mentor_status": "active",
    "name": "郭晟楠",
    "organization_id": "org_auto_51b2e338375f561e2b5a",
    "profile_url": "https://faculty.bjtu.edu.cn/9685",
    "recent_papers": [
      "Low-Rank Prior-Induced Consistency Flow Matching for Efficient Traffic Imputation",
      "RIPCN: A Road Impedance Principal Component Network for Probabilistic Traffic Flow Forecasting",
      "Spatial-Temporal Feedback Diffusion Guidance for Controlled Traffic Imputation",
      "TransferTraj: A Vehicle Trajectory Learning Model for Region and Task Transferability",
      "PLMTrajRec: A Scalable and Generalizable Trajectory Recovery Method with Pre-trained Language Models",
      "TrajMamba: An Efficient and Semantic-rich Vehicle Trajectory Pre-training Model",
      "Balancing Imbalance: Data-Scarce Urban Flow Prediction via Spatio-Temporal Balanced Transfer Learning",
      "TrajCogn: Leveraging LLMs for Cognizing Movement Patterns and Travel Purposes from Trajectories"
    ],
    "research_directions": [
      "时空数据智能、世界模型、具身智能"
    ],
    "source_url": "https://welcome.bjtu.edu.cn/t_brief/0221/#/teacher/computer",
    "submitted_department": "计算机科学与工程系",
    "submitted_school": "计算机科学与技术学院",
    "submitted_university": "北京交通大学",
    "title": "副教授"
  },
  "contributor": {
    "account_age_days_at_submission": 1516,
    "account_created_at": "2022-06-13T08:30:46Z",
    "github_login_at_submission": "JunieXD",
    "github_user_id": 107397009,
    "github_user_type": "User",
    "issue_number": 20,
    "issue_url": "https://github.com/JunieXD/AutoEmailSender-MentorData/issues/20",
    "submitted_at": "2026-08-07T12:05:22Z"
  },
  "evidence": [
    {
      "fields": [
        "name",
        "email",
        "organization_id",
        "title",
        "research_directions",
        "recent_papers",
        "profile_url"
      ],
      "observed_at": "2026-08-07T12:05:22Z",
      "source_url": "https://faculty.bjtu.edu.cn/9685"
    }
  ],
  "id": "claim_c101f686798b7b282c02",
  "mentor_id": "mentor_9b1a24dbbabd58532aa5",
  "moderation": {
    "decision_at": "2026-08-07T12:15:22Z",
    "mode": "manual",
    "moderator_github_user_id": 107397009,
    "normalized_fields": [
      "organization_id"
    ],
    "policy_version": 1,
    "reason": "GitHub PR merge approval"
  },
  "revocation_reason": null,
  "revoked_at": null,
  "schema_version": 1,
  "status": "accepted",
  "submitted": {
    "email": "guoshn@bjtu.edu.cn",
    "mentor_status": "active",
    "name": "郭晟楠",
    "organization_id": null,
    "profile_url": "https://faculty.bjtu.edu.cn/9685",
    "recent_papers": [
      "Low-Rank Prior-Induced Consistency Flow Matching for Efficient Traffic Imputation",
      "RIPCN: A Road Impedance Principal Component Network for Probabilistic Traffic Flow Forecasting",
      "Spatial-Temporal Feedback Diffusion Guidance for Controlled Traffic Imputation",
      "TransferTraj: A Vehicle Trajectory Learning Model for Region and Task Transferability",
      "PLMTrajRec: A Scalable and Generalizable Trajectory Recovery Method with Pre-trained Language Models",
      "TrajMamba: An Efficient and Semantic-rich Vehicle Trajectory Pre-training Model",
      "Balancing Imbalance: Data-Scarce Urban Flow Prediction via Spatio-Temporal Balanced Transfer Learning",
      "TrajCogn: Leveraging LLMs for Cognizing Movement Patterns and Travel Purposes from Trajectories"
    ],
    "research_directions": [
      "时空数据智能、世界模型、具身智能"
    ],
    "source_url": "https://welcome.bjtu.edu.cn/t_brief/0221/#/teacher/computer",
    "submitted_department": "计算机科学与工程系",
    "submitted_school": "计算机科学与技术学院",
    "submitted_university": "北京交通大学",
    "title": "副教授"
  }
}
