{
  "accepted": {
    "email": "wentao@tyut.edu.cn",
    "mentor_status": "active",
    "name": "温涛",
    "organization_id": "org_auto_f695f5b8091a4dd63924",
    "profile_url": "https://eie.tyut.edu.cn/info/1070/2081.htm",
    "recent_papers": [],
    "research_directions": [
      "通讯、电子"
    ],
    "source_url": "https://eie.tyut.edu.cn/szdw/jsml.htm",
    "submitted_department": "通信工程系",
    "submitted_school": "电子信息工程学院",
    "submitted_university": "太原理工大学",
    "title": "讲师"
  },
  "contributor": {
    "account_age_days_at_submission": 1530,
    "account_created_at": "2022-06-13T08:30:46Z",
    "github_login_at_submission": "JunieXD",
    "github_user_id": 107397009,
    "github_user_type": "User",
    "issue_number": 144,
    "issue_url": "https://github.com/JunieXD/AutoEmailSender-MentorData/issues/144",
    "submitted_at": "2026-08-21T18:50:19Z"
  },
  "evidence": [
    {
      "fields": [
        "name",
        "email",
        "organization_id",
        "title",
        "research_directions",
        "profile_url"
      ],
      "observed_at": "2026-08-21T18:50:19Z",
      "source_url": "https://eie.tyut.edu.cn/info/1070/2081.htm"
    }
  ],
  "id": "claim_f16452d730fb64cd488c",
  "mentor_id": "mentor_ed07e4bdcd27bce5d58f",
  "moderation": {
    "decision_at": "2026-08-22T09:10:38Z",
    "mode": "manual",
    "moderator_github_user_id": 107397009,
    "normalized_fields": [
      "organization_id"
    ],
    "policy_version": 1,
    "reason": "GitHub PR merge approval"
  },
  "revocation_reason": null,
  "revoked_at": null,
  "schema_version": 1,
  "status": "accepted",
  "submitted": {
    "email": "wentao@tyut.edu.cn",
    "mentor_status": "active",
    "name": "温涛",
    "organization_id": null,
    "profile_url": "https://eie.tyut.edu.cn/info/1070/2081.htm",
    "recent_papers": [],
    "research_directions": [
      "通讯、电子"
    ],
    "source_url": "https://eie.tyut.edu.cn/szdw/jsml.htm",
    "submitted_department": "通信工程系",
    "submitted_school": "电子信息工程学院",
    "submitted_university": "太原理工大学",
    "title": "讲师"
  }
}
