{
  "accepted": {
    "email": "zhangsw@lzu.edu.cn",
    "mentor_status": "active",
    "name": "张述文",
    "organization_id": "org_auto_3312fb1a9108830bedd6",
    "profile_url": "https://atmos.lzu.edu.cn/html/dqxy/lddqxy/shizitd/jiaoshou/1826800414340694018.html",
    "recent_papers": [
      "Cao, Q., S. W. Zhang*, G. Lei, Y. Zhang. 2022: Impact of different double-moment microphysical schemes on simulations of a bow-shaped squall line in east China. Atmosphere, 13, 667, DOI: 10.3390/atmos13050667",
      "Zhang Y., W. Zhang, Z. Guo, S. W. Zhang. 2022: An effective wind speed prediction model combining secondary decomposition and regularised extreme learning machine optimised by cuckoo search algorithm. Wind Energy. 1‐28, DOI: 10.1002/we.2737",
      "Dang, R. J., X. B. Qiu, Y. Yang, S. W. Zhang. 2022: Observation system simulation experiments (OSSEs) for assimilation of the planetary boundary-layer height (PBLH) using the EnSRF technique. Quarterly Journal of the Royal Meteorological Society, 1–24, DOI: 10.1002/qj.4254",
      "Yang, L. L., S. W. Zhang*, H. J. Tao, Y. P. Yang Y, L. N. Wang, Y. F. Cui, Y. Y. Xu, X. Y. Li. 2022: Comprehensive analysis of a dust storm by a Lidar network combined with multiple data. Front. Environ. Sci., 10, 832710, DOI: 10.3389/fenvs.2022.832710",
      "Yang, L. L., S. W. Zhang*, Z. W. Huang, et al., 2021: Characteristics of dust events in China from 2015 to 2020. Atmosphere, 12(8): 952, DOI:10.3390/atmos12080952",
      "Zou, H. B., S. W. Zhang*, Y. N. Liu, et al., 2020: Analysis of a convective storm crossing Poyang Lake in China. J. Meteor. Res., 34(3), 529-545, DOI: 10.1007/s13351-020-9143-5",
      "任星露, 张述文*, 汪兰, 等,2020: 不同云微物理方案对弱天气尺度强迫下一次强对流的模拟. 高原气象,39(4), 750-761.",
      "李少英, 张述文*,周林帆.2020: 混合同化方法同化地面站和雷达观测对飑线影响的模拟观测试验. 兰州大学学报(自然科学版), 56(5), 642-649."
    ],
    "research_directions": [
      "陆-气相互作用",
      "数值天气预报与资料同化",
      "陆面过程与数据同化",
      "中尺度动力学与数值模拟"
    ],
    "source_url": "https://atmos.lzu.edu.cn/html/dqxy/lddqxy/shizitd/jiaoshou/index.html",
    "submitted_department": "大气科学学院",
    "submitted_school": "大气科学学院",
    "submitted_university": "兰州大学",
    "title": "教授"
  },
  "contributor": {
    "account_age_days_at_submission": 1530,
    "account_created_at": "2022-06-13T08:30:46Z",
    "github_login_at_submission": "JunieXD",
    "github_user_id": 107397009,
    "github_user_type": "User",
    "issue_number": 130,
    "issue_url": "https://github.com/JunieXD/AutoEmailSender-MentorData/issues/130",
    "submitted_at": "2026-08-21T18:48:44Z"
  },
  "evidence": [
    {
      "fields": [
        "name",
        "email",
        "organization_id",
        "title",
        "research_directions",
        "recent_papers",
        "profile_url"
      ],
      "observed_at": "2026-08-21T18:48:44Z",
      "source_url": "https://atmos.lzu.edu.cn/html/dqxy/lddqxy/shizitd/jiaoshou/1826800414340694018.html"
    }
  ],
  "id": "claim_05b8c4715be1922f9e34",
  "mentor_id": "mentor_1cf724d562174adf8675",
  "moderation": {
    "decision_at": "2026-08-22T09:04:20Z",
    "mode": "manual",
    "moderator_github_user_id": 107397009,
    "normalized_fields": [
      "organization_id"
    ],
    "policy_version": 1,
    "reason": "GitHub PR merge approval"
  },
  "revocation_reason": null,
  "revoked_at": null,
  "schema_version": 1,
  "status": "accepted",
  "submitted": {
    "email": "zhangsw@lzu.edu.cn",
    "mentor_status": "active",
    "name": "张述文",
    "organization_id": null,
    "profile_url": "https://atmos.lzu.edu.cn/html/dqxy/lddqxy/shizitd/jiaoshou/1826800414340694018.html",
    "recent_papers": [
      "Cao, Q., S. W. Zhang*, G. Lei, Y. Zhang. 2022: Impact of different double-moment microphysical schemes on simulations of a bow-shaped squall line in east China. Atmosphere, 13, 667, DOI: 10.3390/atmos13050667",
      "Zhang Y., W. Zhang, Z. Guo, S. W. Zhang. 2022: An effective wind speed prediction model combining secondary decomposition and regularised extreme learning machine optimised by cuckoo search algorithm. Wind Energy. 1‐28, DOI: 10.1002/we.2737",
      "Dang, R. J., X. B. Qiu, Y. Yang, S. W. Zhang. 2022: Observation system simulation experiments (OSSEs) for assimilation of the planetary boundary-layer height (PBLH) using the EnSRF technique. Quarterly Journal of the Royal Meteorological Society, 1–24, DOI: 10.1002/qj.4254",
      "Yang, L. L., S. W. Zhang*, H. J. Tao, Y. P. Yang Y, L. N. Wang, Y. F. Cui, Y. Y. Xu, X. Y. Li. 2022: Comprehensive analysis of a dust storm by a Lidar network combined with multiple data. Front. Environ. Sci., 10, 832710, DOI: 10.3389/fenvs.2022.832710",
      "Yang, L. L., S. W. Zhang*, Z. W. Huang, et al., 2021: Characteristics of dust events in China from 2015 to 2020. Atmosphere, 12(8): 952, DOI:10.3390/atmos12080952",
      "Zou, H. B., S. W. Zhang*, Y. N. Liu, et al., 2020: Analysis of a convective storm crossing Poyang Lake in China. J. Meteor. Res., 34(3), 529-545, DOI: 10.1007/s13351-020-9143-5",
      "任星露, 张述文*, 汪兰, 等,2020: 不同云微物理方案对弱天气尺度强迫下一次强对流的模拟. 高原气象,39(4), 750-761.",
      "李少英, 张述文*,周林帆.2020: 混合同化方法同化地面站和雷达观测对飑线影响的模拟观测试验. 兰州大学学报(自然科学版), 56(5), 642-649."
    ],
    "research_directions": [
      "陆-气相互作用",
      "数值天气预报与资料同化",
      "陆面过程与数据同化",
      "中尺度动力学与数值模拟"
    ],
    "source_url": "https://atmos.lzu.edu.cn/html/dqxy/lddqxy/shizitd/jiaoshou/index.html",
    "submitted_department": "大气科学学院",
    "submitted_school": "大气科学学院",
    "submitted_university": "兰州大学",
    "title": "教授"
  }
}
