{
  "accepted": {
    "email": "isswgl@mail.sysu.edu.cn",
    "mentor_status": "active",
    "name": "王国利",
    "organization_id": "org_auto_816b5cc0cdead6c7fef3",
    "profile_url": "https://sse.sysu.edu.cn/teacher/1047",
    "recent_papers": [],
    "research_directions": [
      "普适计算、泛在感知与泛在智能"
    ],
    "source_url": "https://sse.sysu.edu.cn/teacher",
    "submitted_department": "软件工程学院",
    "submitted_school": "软件工程学院",
    "submitted_university": "中山大学",
    "title": "教授"
  },
  "contributor": {
    "account_age_days_at_submission": 1526,
    "account_created_at": "2022-06-13T08:30:46Z",
    "github_login_at_submission": "JunieXD",
    "github_user_id": 107397009,
    "github_user_type": "User",
    "issue_number": 85,
    "issue_url": "https://github.com/JunieXD/AutoEmailSender-MentorData/issues/85",
    "submitted_at": "2026-08-17T10:21:46Z"
  },
  "evidence": [
    {
      "fields": [
        "name",
        "email",
        "organization_id",
        "title",
        "research_directions",
        "profile_url"
      ],
      "observed_at": "2026-08-17T10:21:46Z",
      "source_url": "https://sse.sysu.edu.cn/teacher/1047"
    }
  ],
  "id": "claim_6e36fc10e5cc676a5e6b",
  "mentor_id": "mentor_d149d4fd5d16550c37d3",
  "moderation": {
    "decision_at": "2026-08-17T11:11:04Z",
    "mode": "manual",
    "moderator_github_user_id": 107397009,
    "normalized_fields": [
      "organization_id"
    ],
    "policy_version": 1,
    "reason": "GitHub PR merge approval"
  },
  "revocation_reason": null,
  "revoked_at": null,
  "schema_version": 1,
  "status": "accepted",
  "submitted": {
    "email": "isswgl@mail.sysu.edu.cn",
    "mentor_status": "active",
    "name": "王国利",
    "organization_id": null,
    "profile_url": "https://sse.sysu.edu.cn/teacher/1047",
    "recent_papers": [],
    "research_directions": [
      "普适计算、泛在感知与泛在智能"
    ],
    "source_url": "https://sse.sysu.edu.cn/teacher",
    "submitted_department": "软件工程学院",
    "submitted_school": "软件工程学院",
    "submitted_university": "中山大学",
    "title": "教授"
  }
}
