{
  "accepted": {
    "email": "diyuxu@163.com",
    "mentor_status": "active",
    "name": "徐涤宇",
    "organization_id": "org_auto_762b02c4eb22f2b56a4b",
    "profile_url": "https://law.zuel.edu.cn/2025/0525/c16276a397210/page.htm",
    "recent_papers": [
      "《物业服务合同法律构造之中国模式》,载《法学研究》2021年第3期,独撰",
      "《非常态缔约规则:现行法检讨与民法典回应》,载《法商研究》2019年第3期,独撰",
      "《婚姻家庭法的入典再造:理念与细节》,载《中国法律评论》2019年第1期,独撰",
      "《<合同法>第80条(债权让与通知)评注》,载《法学家》2019年第1期,独撰",
      "《解法典后的再法典化:阿根廷民商法典启示录》,载《比较法研究》2018年第1期,独撰",
      "《代理制度如何贯彻私法自治 <民法总则>代理制度评述》,载《中外法学》2017年第3期,独撰",
      "《历史视野下夹缠于非婚和婚姻之间的事实婚——兼论我国未来民法典对事实婚的应然构建》,载《法学评论》2016年第3期,独撰",
      "《民事证明责任分配之解释基准——以<物权法>第106条为分析文本》,载《法学研究》2016年第2期,独撰"
    ],
    "research_directions": [
      "民法学、私法史"
    ],
    "source_url": "https://law.zuel.edu.cn/szdw/list.htm",
    "submitted_department": "法学院",
    "submitted_school": "法学院",
    "submitted_university": "中南财经政法大学",
    "title": "教授"
  },
  "contributor": {
    "account_age_days_at_submission": 1530,
    "account_created_at": "2022-06-13T08:30:46Z",
    "github_login_at_submission": "JunieXD",
    "github_user_id": 107397009,
    "github_user_type": "User",
    "issue_number": 182,
    "issue_url": "https://github.com/JunieXD/AutoEmailSender-MentorData/issues/182",
    "submitted_at": "2026-08-21T18:54:04Z"
  },
  "evidence": [
    {
      "fields": [
        "name",
        "email",
        "organization_id",
        "title",
        "research_directions",
        "recent_papers",
        "profile_url"
      ],
      "observed_at": "2026-08-21T18:54:04Z",
      "source_url": "https://law.zuel.edu.cn/2025/0525/c16276a397210/page.htm"
    }
  ],
  "id": "claim_7f30207339ac0eb168f4",
  "mentor_id": "mentor_c7ab2d3232ae43e6bcf1",
  "moderation": {
    "decision_at": "2026-08-22T10:35:41Z",
    "mode": "manual",
    "moderator_github_user_id": 107397009,
    "normalized_fields": [
      "organization_id"
    ],
    "policy_version": 1,
    "reason": "GitHub PR merge approval"
  },
  "revocation_reason": null,
  "revoked_at": null,
  "schema_version": 1,
  "status": "accepted",
  "submitted": {
    "email": "diyuxu@163.com",
    "mentor_status": "active",
    "name": "徐涤宇",
    "organization_id": null,
    "profile_url": "https://law.zuel.edu.cn/2025/0525/c16276a397210/page.htm",
    "recent_papers": [
      "《物业服务合同法律构造之中国模式》,载《法学研究》2021年第3期,独撰",
      "《非常态缔约规则:现行法检讨与民法典回应》,载《法商研究》2019年第3期,独撰",
      "《婚姻家庭法的入典再造:理念与细节》,载《中国法律评论》2019年第1期,独撰",
      "《<合同法>第80条(债权让与通知)评注》,载《法学家》2019年第1期,独撰",
      "《解法典后的再法典化:阿根廷民商法典启示录》,载《比较法研究》2018年第1期,独撰",
      "《代理制度如何贯彻私法自治 <民法总则>代理制度评述》,载《中外法学》2017年第3期,独撰",
      "《历史视野下夹缠于非婚和婚姻之间的事实婚——兼论我国未来民法典对事实婚的应然构建》,载《法学评论》2016年第3期,独撰",
      "《民事证明责任分配之解释基准——以<物权法>第106条为分析文本》,载《法学研究》2016年第2期,独撰"
    ],
    "research_directions": [
      "民法学、私法史"
    ],
    "source_url": "https://law.zuel.edu.cn/szdw/list.htm",
    "submitted_department": "法学院",
    "submitted_school": "法学院",
    "submitted_university": "中南财经政法大学",
    "title": "教授"
  }
}
