{
  "accepted": {
    "email": "fzusc09@126.com",
    "mentor_status": "active",
    "name": "廖祥文",
    "organization_id": "org_auto_8c7710e323621aa926e8",
    "profile_url": "https://ccds.fzu.edu.cn/info/1202/5001.htm",
    "recent_papers": [
      "From Attribution to Action: Jointly ALIGNing Predictions and Explanations. AAAI 2026, Singapore.",
      "MSR: A Multifaceted Self-Retrieval Framework for Microscopic Cascade Prediction. AAAI 2025, USA",
      "Training for Stable Explanation for Free. NeurIPS 2024, Canada",
      "An Iterative Associative Memory Model for Empathetic Response Generation. ACL 2024: 3081–3092, Thailand",
      "基于深度学习的情感对话响应综述,计算机学报,2023,46(12): 2489-2519",
      "CTSM: Combining Trait and State Emotions for Empathetic Response Model. LREC-COLING 2024:4214–4225, Italy",
      "Situation-aware empathetic response generation. Information Processing & Management, 2024, 61(6): 103824",
      "Exploiting Emotion-Semantic Correlations for Empathetic Response Generation. In Findings of EMNLP 2023: 4826–4837, Singapore"
    ],
    "research_directions": [
      "自然语言处理、大模型技术、网络大数据分析、AI4Science(智能医学、医工交叉等)、网络内容安全/人工智能安全、医疗大数据与智能医学(医疗多模态大模型)"
    ],
    "source_url": "https://ccds.fzu.edu.cn/szdw/szxx.htm",
    "submitted_department": "计算机与大数据学院/软件学院",
    "submitted_school": "计算机与大数据学院",
    "submitted_university": "福州大学",
    "title": "教授"
  },
  "contributor": {
    "account_age_days_at_submission": 1530,
    "account_created_at": "2022-06-13T08:30:46Z",
    "github_login_at_submission": "JunieXD",
    "github_user_id": 107397009,
    "github_user_type": "User",
    "issue_number": 114,
    "issue_url": "https://github.com/JunieXD/AutoEmailSender-MentorData/issues/114",
    "submitted_at": "2026-08-21T18:45:03Z"
  },
  "evidence": [
    {
      "fields": [
        "name",
        "email",
        "organization_id",
        "title",
        "research_directions",
        "recent_papers",
        "profile_url"
      ],
      "observed_at": "2026-08-21T18:45:03Z",
      "source_url": "https://ccds.fzu.edu.cn/info/1202/5001.htm"
    }
  ],
  "id": "claim_8a5a300e66743f30b8d0",
  "mentor_id": "mentor_3b0b38a2b82315ace37b",
  "moderation": {
    "decision_at": "2026-08-22T08:57:06Z",
    "mode": "manual",
    "moderator_github_user_id": 107397009,
    "normalized_fields": [
      "organization_id"
    ],
    "policy_version": 1,
    "reason": "GitHub PR merge approval"
  },
  "revocation_reason": null,
  "revoked_at": null,
  "schema_version": 1,
  "status": "accepted",
  "submitted": {
    "email": "fzusc09@126.com",
    "mentor_status": "active",
    "name": "廖祥文",
    "organization_id": null,
    "profile_url": "https://ccds.fzu.edu.cn/info/1202/5001.htm",
    "recent_papers": [
      "From Attribution to Action: Jointly ALIGNing Predictions and Explanations. AAAI 2026, Singapore.",
      "MSR: A Multifaceted Self-Retrieval Framework for Microscopic Cascade Prediction. AAAI 2025, USA",
      "Training for Stable Explanation for Free. NeurIPS 2024, Canada",
      "An Iterative Associative Memory Model for Empathetic Response Generation. ACL 2024: 3081–3092, Thailand",
      "基于深度学习的情感对话响应综述,计算机学报,2023,46(12): 2489-2519",
      "CTSM: Combining Trait and State Emotions for Empathetic Response Model. LREC-COLING 2024:4214–4225, Italy",
      "Situation-aware empathetic response generation. Information Processing & Management, 2024, 61(6): 103824",
      "Exploiting Emotion-Semantic Correlations for Empathetic Response Generation. In Findings of EMNLP 2023: 4826–4837, Singapore"
    ],
    "research_directions": [
      "自然语言处理、大模型技术、网络大数据分析、AI4Science(智能医学、医工交叉等)、网络内容安全/人工智能安全、医疗大数据与智能医学(医疗多模态大模型)"
    ],
    "source_url": "https://ccds.fzu.edu.cn/szdw/szxx.htm",
    "submitted_department": "计算机与大数据学院/软件学院",
    "submitted_school": "计算机与大数据学院",
    "submitted_university": "福州大学",
    "title": "教授"
  }
}
