{
  "accepted": {
    "email": "lijuan@fzu.edu.cn",
    "mentor_status": "active",
    "name": "李娟",
    "organization_id": "org_auto_fc405e33dcdd34f45648",
    "profile_url": "https://chem.fzu.edu.cn/info/1194/14172.htm",
    "recent_papers": [
      "Circular DNA: a stable probe for highly efficient mRNA imaging and gene therapy in living cells",
      "Au@Pt nanoparticles as catalase mimics to attenuate tumor hypoxia and enhance immune cell-mediated cytotoxicity",
      "Semipermeable Functional DNA-Encapsulated Nanocapsules as Protective Bioreactors for Biosensing in Living Cells",
      "Repeatable deep-tissue activation of persistent luminescent nanoparticles by soft X-ray for high sensitivity long-term in vivo bioimaging",
      "Polyphenol-Inspired Facile Construction of Smart Assemblies for ATP- and pH-Responsive Tumor MR/Optical Imaging and Photothermal Therapy",
      "Functional nucleic acid-based hydrogels for bioanalytical and biomedical applications",
      "Versatile surface engineering of porous nanomaterials with bioinspired polyphenol coatings for targeted and controlled drug delivery",
      "Magnetic Graphene Nanosheet-Based Microfluidic Device for Homogeneous Real-Time Electronic Monitoring of Pyrophosphatase Activity Using Enzymatic Hydrolysate-Induced Release of Copper Ion"
    ],
    "research_directions": [
      "新型光学成像探针、活细胞膜分析,纳米诊疗"
    ],
    "source_url": "https://chem.fzu.edu.cn/szdw/jsml1.htm",
    "submitted_department": "福州大学化学学院",
    "submitted_school": "化学学院",
    "submitted_university": "福州大学",
    "title": "教授"
  },
  "contributor": {
    "account_age_days_at_submission": 1530,
    "account_created_at": "2022-06-13T08:30:46Z",
    "github_login_at_submission": "JunieXD",
    "github_user_id": 107397009,
    "github_user_type": "User",
    "issue_number": 112,
    "issue_url": "https://github.com/JunieXD/AutoEmailSender-MentorData/issues/112",
    "submitted_at": "2026-08-21T18:44:51Z"
  },
  "evidence": [
    {
      "fields": [
        "name",
        "email",
        "organization_id",
        "title",
        "research_directions",
        "recent_papers",
        "profile_url"
      ],
      "observed_at": "2026-08-21T18:44:51Z",
      "source_url": "https://chem.fzu.edu.cn/info/1194/14172.htm"
    }
  ],
  "id": "claim_9ac5215e89f8d140b733",
  "mentor_id": "mentor_2e0e5bc95723c27d8cd0",
  "moderation": {
    "decision_at": "2026-08-22T08:56:20Z",
    "mode": "manual",
    "moderator_github_user_id": 107397009,
    "normalized_fields": [
      "organization_id"
    ],
    "policy_version": 1,
    "reason": "GitHub PR merge approval"
  },
  "revocation_reason": null,
  "revoked_at": null,
  "schema_version": 1,
  "status": "accepted",
  "submitted": {
    "email": "lijuan@fzu.edu.cn",
    "mentor_status": "active",
    "name": "李娟",
    "organization_id": null,
    "profile_url": "https://chem.fzu.edu.cn/info/1194/14172.htm",
    "recent_papers": [
      "Circular DNA: a stable probe for highly efficient mRNA imaging and gene therapy in living cells",
      "Au@Pt nanoparticles as catalase mimics to attenuate tumor hypoxia and enhance immune cell-mediated cytotoxicity",
      "Semipermeable Functional DNA-Encapsulated Nanocapsules as Protective Bioreactors for Biosensing in Living Cells",
      "Repeatable deep-tissue activation of persistent luminescent nanoparticles by soft X-ray for high sensitivity long-term in vivo bioimaging",
      "Polyphenol-Inspired Facile Construction of Smart Assemblies for ATP- and pH-Responsive Tumor MR/Optical Imaging and Photothermal Therapy",
      "Functional nucleic acid-based hydrogels for bioanalytical and biomedical applications",
      "Versatile surface engineering of porous nanomaterials with bioinspired polyphenol coatings for targeted and controlled drug delivery",
      "Magnetic Graphene Nanosheet-Based Microfluidic Device for Homogeneous Real-Time Electronic Monitoring of Pyrophosphatase Activity Using Enzymatic Hydrolysate-Induced Release of Copper Ion"
    ],
    "research_directions": [
      "新型光学成像探针、活细胞膜分析,纳米诊疗"
    ],
    "source_url": "https://chem.fzu.edu.cn/szdw/jsml1.htm",
    "submitted_department": "福州大学化学学院",
    "submitted_school": "化学学院",
    "submitted_university": "福州大学",
    "title": "教授"
  }
}
