{
  "accepted": {
    "email": "wupin@shu.edu.cn",
    "mentor_status": "active",
    "name": "武频",
    "organization_id": "org_auto_268a039852244ae4c1f0",
    "profile_url": "https://cs.shu.edu.cn/info/1461/40521.htm",
    "recent_papers": [],
    "research_directions": [
      "智能科学计算、大数据分析、图像处理"
    ],
    "source_url": "https://cs.shu.edu.cn/szdw/jsml.htm",
    "submitted_department": "计算机工程与科学学院",
    "submitted_school": "计算机工程与科学学院",
    "submitted_university": "上海大学",
    "title": "教授"
  },
  "contributor": {
    "account_age_days_at_submission": 1520,
    "account_created_at": "2022-06-13T08:30:46Z",
    "github_login_at_submission": "JunieXD",
    "github_user_id": 107397009,
    "github_user_type": "User",
    "issue_number": 38,
    "issue_url": "https://github.com/JunieXD/AutoEmailSender-MentorData/issues/38",
    "submitted_at": "2026-08-11T13:30:02Z"
  },
  "evidence": [
    {
      "fields": [
        "name",
        "email",
        "organization_id",
        "title",
        "research_directions",
        "profile_url"
      ],
      "observed_at": "2026-08-11T13:30:02Z",
      "source_url": "https://cs.shu.edu.cn/info/1461/40521.htm"
    }
  ],
  "id": "claim_9e60f5253607abb9573c",
  "mentor_id": "mentor_158ad05685f59ae4f7d8",
  "moderation": {
    "decision_at": "2026-08-12T09:29:33Z",
    "mode": "manual",
    "moderator_github_user_id": 107397009,
    "normalized_fields": [
      "organization_id"
    ],
    "policy_version": 1,
    "reason": "GitHub PR merge approval"
  },
  "revocation_reason": null,
  "revoked_at": null,
  "schema_version": 1,
  "status": "accepted",
  "submitted": {
    "email": "wupin@shu.edu.cn",
    "mentor_status": "active",
    "name": "武频",
    "organization_id": null,
    "profile_url": "https://cs.shu.edu.cn/info/1461/40521.htm",
    "recent_papers": [],
    "research_directions": [
      "智能科学计算、大数据分析、图像处理"
    ],
    "source_url": "https://cs.shu.edu.cn/szdw/jsml.htm",
    "submitted_department": "计算机工程与科学学院",
    "submitted_school": "计算机工程与科学学院",
    "submitted_university": "上海大学",
    "title": "教授"
  }
}
