{
  "accepted": {
    "email": "vivienyan@sina.com",
    "mentor_status": "active",
    "name": "杨小敏",
    "organization_id": "org_auto_762b02c4eb22f2b56a4b",
    "profile_url": "https://law.zuel.edu.cn/2025/0525/c16276a395678/page.htm",
    "recent_papers": [
      "《全过程人民民主的三个向度及其宪法展开》",
      "《法院依照法律规定独立行使审判权条款的宪法变迁》",
      "《论新时代中国特色社会主义法治建设的系统观》",
      "《新中国审判独立的行政权之维探源》",
      "《论我国流域环境行政执法模式的理念、功能与制度特色》",
      "《食品安全社会共治原则的学理建构》",
      "《论“混合式”公共风险监管法实施制度》",
      "《晚清司法权概念考——以宪法学为视角》"
    ],
    "research_directions": [
      "宪法学、行政法学"
    ],
    "source_url": "https://law.zuel.edu.cn/szdw/list.htm",
    "submitted_department": "法学院",
    "submitted_school": "法学院",
    "submitted_university": "中南财经政法大学",
    "title": "教授"
  },
  "contributor": {
    "account_age_days_at_submission": 1530,
    "account_created_at": "2022-06-13T08:30:46Z",
    "github_login_at_submission": "JunieXD",
    "github_user_id": 107397009,
    "github_user_type": "User",
    "issue_number": 182,
    "issue_url": "https://github.com/JunieXD/AutoEmailSender-MentorData/issues/182",
    "submitted_at": "2026-08-21T18:54:04Z"
  },
  "evidence": [
    {
      "fields": [
        "name",
        "email",
        "organization_id",
        "title",
        "research_directions",
        "recent_papers",
        "profile_url"
      ],
      "observed_at": "2026-08-21T18:54:04Z",
      "source_url": "https://law.zuel.edu.cn/2025/0525/c16276a395678/page.htm"
    }
  ],
  "id": "claim_d8a3c934c3ec8cb14308",
  "mentor_id": "mentor_7e17e861f0d2205b02e0",
  "moderation": {
    "decision_at": "2026-08-22T10:35:41Z",
    "mode": "manual",
    "moderator_github_user_id": 107397009,
    "normalized_fields": [
      "organization_id"
    ],
    "policy_version": 1,
    "reason": "GitHub PR merge approval"
  },
  "revocation_reason": null,
  "revoked_at": null,
  "schema_version": 1,
  "status": "accepted",
  "submitted": {
    "email": "vivienyan@sina.com",
    "mentor_status": "active",
    "name": "杨小敏",
    "organization_id": null,
    "profile_url": "https://law.zuel.edu.cn/2025/0525/c16276a395678/page.htm",
    "recent_papers": [
      "《全过程人民民主的三个向度及其宪法展开》",
      "《法院依照法律规定独立行使审判权条款的宪法变迁》",
      "《论新时代中国特色社会主义法治建设的系统观》",
      "《新中国审判独立的行政权之维探源》",
      "《论我国流域环境行政执法模式的理念、功能与制度特色》",
      "《食品安全社会共治原则的学理建构》",
      "《论“混合式”公共风险监管法实施制度》",
      "《晚清司法权概念考——以宪法学为视角》"
    ],
    "research_directions": [
      "宪法学、行政法学"
    ],
    "source_url": "https://law.zuel.edu.cn/szdw/list.htm",
    "submitted_department": "法学院",
    "submitted_school": "法学院",
    "submitted_university": "中南财经政法大学",
    "title": "教授"
  }
}
