{
  "accepted": {
    "email": "shenghong@ncu.edu.cn",
    "mentor_status": "active",
    "name": "洪升",
    "organization_id": "org_auto_6b8c7361be4c6bdee597",
    "profile_url": "https://teacher.ncu.edu.cn/publish/092155",
    "recent_papers": [
      "Artificial-Noise-Aided Secure MIMO Wireless Communications via Intelligent Reflecting Surface"
    ],
    "research_directions": [
      "雷达和无线通信信号处理、可重构智能超表面辅助通信感知一体化、人工智能在雷达和通信中的应用、无线通信物理层安全"
    ],
    "source_url": "https://ie.ncu.edu.cn/szdw/zzjs/dgdzsyzx.htm",
    "submitted_department": null,
    "submitted_school": "信息工程学院",
    "submitted_university": "南昌大学",
    "title": "副教授"
  },
  "contributor": {
    "account_age_days_at_submission": 1530,
    "account_created_at": "2022-06-13T08:30:46Z",
    "github_login_at_submission": "JunieXD",
    "github_user_id": 107397009,
    "github_user_type": "User",
    "issue_number": 131,
    "issue_url": "https://github.com/JunieXD/AutoEmailSender-MentorData/issues/131",
    "submitted_at": "2026-08-21T18:48:49Z"
  },
  "evidence": [
    {
      "fields": [
        "name",
        "email",
        "organization_id",
        "title",
        "research_directions",
        "recent_papers",
        "profile_url"
      ],
      "observed_at": "2026-08-21T18:48:49Z",
      "source_url": "https://teacher.ncu.edu.cn/publish/092155"
    }
  ],
  "id": "claim_f91235687a92aa9def62",
  "mentor_id": "mentor_e5bfca3a9ef40ffaf75e",
  "moderation": {
    "decision_at": "2026-08-22T09:49:43Z",
    "mode": "manual",
    "moderator_github_user_id": 107397009,
    "normalized_fields": [
      "organization_id"
    ],
    "policy_version": 1,
    "reason": "GitHub PR merge approval"
  },
  "revocation_reason": null,
  "revoked_at": null,
  "schema_version": 1,
  "status": "accepted",
  "submitted": {
    "email": "shenghong@ncu.edu.cn",
    "mentor_status": "active",
    "name": "洪升",
    "organization_id": null,
    "profile_url": "https://teacher.ncu.edu.cn/publish/092155",
    "recent_papers": [
      "Artificial-Noise-Aided Secure MIMO Wireless Communications via Intelligent Reflecting Surface"
    ],
    "research_directions": [
      "雷达和无线通信信号处理、可重构智能超表面辅助通信感知一体化、人工智能在雷达和通信中的应用、无线通信物理层安全"
    ],
    "source_url": "https://ie.ncu.edu.cn/szdw/zzjs/dgdzsyzx.htm",
    "submitted_department": null,
    "submitted_school": "信息工程学院",
    "submitted_university": "南昌大学",
    "title": "副教授"
  }
}
