{
  "accepted": {
    "email": "yjf@szu.edu.cn",
    "mentor_status": "active",
    "name": "尹剑飞",
    "organization_id": "org_auto_a3d506fcc50965fcb97c",
    "profile_url": "https://csse.szu.edu.cn/pages/user/index?id=554",
    "recent_papers": [
      "Shiyang Hao, Yi Liu, Hanyu Yang, Junjie Liu, and Jianfei Yin*. \"An Incremental Learning Approach for Micro-credit Approval.\" The 13th IEEE International Conference on Big Data (IEEE BigData 2025), Macau SAR, China, 2025",
      "Song, Jianzeng, Senjie Xia, Yong Zhang, Jie Wei, and Jianfei Yin*. \"When Coordinated Knowledge Distillation Meets Mixture of Expert Inference: Insights from Portfolio Optimization.\" International Conference on Intelligent Computing. Ningbo, China, 2025.",
      "Yin, Jianfei, Anyang Zhong, Xiaomian Xiao, Ruili Wang, and Joshua Zhexue Huang. \"An asset subset-constrained minimax optimization framework for online portfolio selection.\" Expert Systems with Applications 254 (2024): 124299.",
      "Chao, Kaiyin, Jing Peng, Xiaomian Xiao, Jinglan Deng, Hanyu Yang, and Jianfei Yin*. \"GA-MEPS: Multiple Experts Portfolio Selection Based on Genetic Algorithm.\" In International Conference on Knowledge Science, Engineering and Management, pp. 123-133. Singapore: Springer Nature Singapore, 2024.",
      "Peng, Jing, Kaiyin Chao, Geying Chen, and Jianfei Yin*. \"An Online Portfolio Selection Algorithm with Dynamic Coreset Construction.\" In International Conference on Knowledge Science, Engineering and Management, pp. 27-37. Singapore: Springer Nature Singapore, 2024.",
      "Chen, Geying, Anyang Zhong, Jing Peng, and Jianfei Yin*. \"STM: An Improved Peak Price Tracking-Based Online Portfolio Selection Algorithm.\" In International Conference on Knowledge Science, Engineering and Management, pp. 347-359. Singapore: Springer Nature Singapore, 2024.",
      "Xie, Kailin, Jianfei Yin, Hengyong Yu, Hong Fu, and Ying Chu. \"Passive aggressive ensemble for online portfolio selection.\" Mathematics 12, no. 7 (2024): 956.",
      "Yin, Jianfei, Ruili Wang, Yeqing Guo, Yizhe Bai, Shunda Ju, Weili Liu, and Joshua Zhexue Huang. \"Wealth flow model: online portfolio selection based on learning wealth flow matrices.\" ACM Transactions on Knowledge Discovery from Data (TKDD) 16, no. 2 (2021): 1-27."
    ],
    "research_directions": [
      "工业物联网, 优化算法, 软件工程"
    ],
    "source_url": "https://csse.szu.edu.cn/pages/teacherTeam/index?p=1&sx=2",
    "submitted_department": "大数据技术与应用研究所",
    "submitted_school": "计算机与软件学院",
    "submitted_university": "深圳大学",
    "title": "副教授"
  },
  "contributor": {
    "account_age_days_at_submission": 1515,
    "account_created_at": "2022-06-13T08:30:46Z",
    "github_login_at_submission": "JunieXD",
    "github_user_id": 107397009,
    "github_user_type": "User",
    "issue_number": 12,
    "issue_url": "https://github.com/JunieXD/AutoEmailSender-MentorData/issues/12",
    "submitted_at": "2026-08-07T07:40:45Z"
  },
  "evidence": [
    {
      "fields": [
        "name",
        "email",
        "organization_id",
        "title",
        "research_directions",
        "recent_papers",
        "profile_url"
      ],
      "observed_at": "2026-08-07T07:40:45Z",
      "source_url": "https://csse.szu.edu.cn/pages/user/index?id=554"
    }
  ],
  "id": "claim_5cd94d7a6d347ab518e2",
  "mentor_id": "mentor_750a02462ca3a737ef68",
  "moderation": {
    "decision_at": "2026-08-07T07:42:47Z",
    "mode": "manual",
    "moderator_github_user_id": 107397009,
    "normalized_fields": [
      "organization_id"
    ],
    "policy_version": 1,
    "reason": "GitHub PR merge approval"
  },
  "revocation_reason": null,
  "revoked_at": null,
  "schema_version": 1,
  "status": "accepted",
  "submitted": {
    "email": "yjf@szu.edu.cn",
    "mentor_status": "active",
    "name": "尹剑飞",
    "organization_id": null,
    "profile_url": "https://csse.szu.edu.cn/pages/user/index?id=554",
    "recent_papers": [
      "Shiyang Hao, Yi Liu, Hanyu Yang, Junjie Liu, and Jianfei Yin*. \"An Incremental Learning Approach for Micro-credit Approval.\" The 13th IEEE International Conference on Big Data (IEEE BigData 2025), Macau SAR, China, 2025",
      "Song, Jianzeng, Senjie Xia, Yong Zhang, Jie Wei, and Jianfei Yin*. \"When Coordinated Knowledge Distillation Meets Mixture of Expert Inference: Insights from Portfolio Optimization.\" International Conference on Intelligent Computing. Ningbo, China, 2025.",
      "Yin, Jianfei, Anyang Zhong, Xiaomian Xiao, Ruili Wang, and Joshua Zhexue Huang. \"An asset subset-constrained minimax optimization framework for online portfolio selection.\" Expert Systems with Applications 254 (2024): 124299.",
      "Chao, Kaiyin, Jing Peng, Xiaomian Xiao, Jinglan Deng, Hanyu Yang, and Jianfei Yin*. \"GA-MEPS: Multiple Experts Portfolio Selection Based on Genetic Algorithm.\" In International Conference on Knowledge Science, Engineering and Management, pp. 123-133. Singapore: Springer Nature Singapore, 2024.",
      "Peng, Jing, Kaiyin Chao, Geying Chen, and Jianfei Yin*. \"An Online Portfolio Selection Algorithm with Dynamic Coreset Construction.\" In International Conference on Knowledge Science, Engineering and Management, pp. 27-37. Singapore: Springer Nature Singapore, 2024.",
      "Chen, Geying, Anyang Zhong, Jing Peng, and Jianfei Yin*. \"STM: An Improved Peak Price Tracking-Based Online Portfolio Selection Algorithm.\" In International Conference on Knowledge Science, Engineering and Management, pp. 347-359. Singapore: Springer Nature Singapore, 2024.",
      "Xie, Kailin, Jianfei Yin, Hengyong Yu, Hong Fu, and Ying Chu. \"Passive aggressive ensemble for online portfolio selection.\" Mathematics 12, no. 7 (2024): 956.",
      "Yin, Jianfei, Ruili Wang, Yeqing Guo, Yizhe Bai, Shunda Ju, Weili Liu, and Joshua Zhexue Huang. \"Wealth flow model: online portfolio selection based on learning wealth flow matrices.\" ACM Transactions on Knowledge Discovery from Data (TKDD) 16, no. 2 (2021): 1-27."
    ],
    "research_directions": [
      "工业物联网, 优化算法, 软件工程"
    ],
    "source_url": "https://csse.szu.edu.cn/pages/teacherTeam/index?p=1&sx=2",
    "submitted_department": "大数据技术与应用研究所",
    "submitted_school": "计算机与软件学院",
    "submitted_university": "深圳大学",
    "title": "副教授"
  }
}
