{
  "accepted": {
    "email": "linglingzhang@neau.edu.cn",
    "mentor_status": "active",
    "name": "张玲玲",
    "organization_id": "org_auto_4d766304be22d769c245",
    "profile_url": "https://hxxy.neau.edu.cn/info/1142/1501.htm",
    "recent_papers": [
      "Multiple hydrogen bonds enable an ultra-rapid self-healing polymer electrolyte for high-performance lithium-metal batteries",
      "Natural-Inspired Ultra-Flexible Lithium-Ion Batteries With Fractal Fern Architecture for Extreme Bending and Long-Lived Stability",
      "Interfacial Stabilization Enabled by Triethyl Borate for High-Voltage Batteries with Superior Wide-Temperature Range",
      "Self-healing functional materials for advanced batteries: Mechanisms, dynamics, and applications",
      "Phase Purification and Crystallology Engineering Enable Fast-Charging Na5Fe2.9Ni0.1(PO4)2(P2O7) Cathode for Wide-Temperature Sodium-Ion Batteries"
    ],
    "research_directions": [
      "锂/钠离子电池、聚合物电解质、锂枝晶、自愈合聚合物电解质构筑与性能调控、锂/钠离子电池关键电极材料研发、高性能电解液添加剂创制与应用研究、电池界面稳定机制与调控研究、新型柔性储能电池结构设计与优化、新能源储能材料研发、电池安全可靠性研究"
    ],
    "source_url": "https://hxxy.neau.edu.cn/szdw1/jsdw/zrjs/fjs/2.htm",
    "submitted_department": "化学生物学系",
    "submitted_school": "化学与分子工程学院",
    "submitted_university": "东北农业大学",
    "title": "副教授"
  },
  "contributor": {
    "account_age_days_at_submission": 1530,
    "account_created_at": "2022-06-13T08:30:46Z",
    "github_login_at_submission": "JunieXD",
    "github_user_id": 107397009,
    "github_user_type": "User",
    "issue_number": 110,
    "issue_url": "https://github.com/JunieXD/AutoEmailSender-MentorData/issues/110",
    "submitted_at": "2026-08-21T18:44:44Z"
  },
  "evidence": [
    {
      "fields": [
        "name",
        "email",
        "organization_id",
        "title",
        "research_directions",
        "recent_papers",
        "profile_url"
      ],
      "observed_at": "2026-08-21T18:44:44Z",
      "source_url": "https://hxxy.neau.edu.cn/info/1142/1501.htm"
    }
  ],
  "id": "claim_401006cb90f11356f44a",
  "mentor_id": "mentor_41964a822af01ac81159",
  "moderation": {
    "decision_at": "2026-08-22T08:55:39Z",
    "mode": "manual",
    "moderator_github_user_id": 107397009,
    "normalized_fields": [
      "organization_id"
    ],
    "policy_version": 1,
    "reason": "GitHub PR merge approval"
  },
  "revocation_reason": null,
  "revoked_at": null,
  "schema_version": 1,
  "status": "accepted",
  "submitted": {
    "email": "linglingzhang@neau.edu.cn",
    "mentor_status": "active",
    "name": "张玲玲",
    "organization_id": null,
    "profile_url": "https://hxxy.neau.edu.cn/info/1142/1501.htm",
    "recent_papers": [
      "Multiple hydrogen bonds enable an ultra-rapid self-healing polymer electrolyte for high-performance lithium-metal batteries",
      "Natural-Inspired Ultra-Flexible Lithium-Ion Batteries With Fractal Fern Architecture for Extreme Bending and Long-Lived Stability",
      "Interfacial Stabilization Enabled by Triethyl Borate for High-Voltage Batteries with Superior Wide-Temperature Range",
      "Self-healing functional materials for advanced batteries: Mechanisms, dynamics, and applications",
      "Phase Purification and Crystallology Engineering Enable Fast-Charging Na5Fe2.9Ni0.1(PO4)2(P2O7) Cathode for Wide-Temperature Sodium-Ion Batteries"
    ],
    "research_directions": [
      "锂/钠离子电池、聚合物电解质、锂枝晶、自愈合聚合物电解质构筑与性能调控、锂/钠离子电池关键电极材料研发、高性能电解液添加剂创制与应用研究、电池界面稳定机制与调控研究、新型柔性储能电池结构设计与优化、新能源储能材料研发、电池安全可靠性研究"
    ],
    "source_url": "https://hxxy.neau.edu.cn/szdw1/jsdw/zrjs/fjs/2.htm",
    "submitted_department": "化学生物学系",
    "submitted_school": "化学与分子工程学院",
    "submitted_university": "东北农业大学",
    "title": "副教授"
  }
}
