{
  "accepted": {
    "email": "guangxuwang@ncu.edu.cn",
    "mentor_status": "active",
    "name": "王光绪",
    "organization_id": "org_auto_6b8c7361be4c6bdee597",
    "profile_url": "https://teacher.ncu.edu.cn/publish/091901",
    "recent_papers": [],
    "research_directions": [
      "高光效、高可靠性硅基氮化镓LED芯片器件技术创新与成果转化"
    ],
    "source_url": "https://ie.ncu.edu.cn/szdw/yjszdjs/xxytxgcbsdds.htm",
    "submitted_department": "国家硅基LED工程技术研究中心、南昌实验室",
    "submitted_school": "信息工程学院",
    "submitted_university": "南昌大学",
    "title": "研究员"
  },
  "contributor": {
    "account_age_days_at_submission": 1530,
    "account_created_at": "2022-06-13T08:30:46Z",
    "github_login_at_submission": "JunieXD",
    "github_user_id": 107397009,
    "github_user_type": "User",
    "issue_number": 131,
    "issue_url": "https://github.com/JunieXD/AutoEmailSender-MentorData/issues/131",
    "submitted_at": "2026-08-21T18:48:49Z"
  },
  "evidence": [
    {
      "fields": [
        "name",
        "email",
        "organization_id",
        "title",
        "research_directions",
        "profile_url"
      ],
      "observed_at": "2026-08-21T18:48:49Z",
      "source_url": "https://teacher.ncu.edu.cn/publish/091901"
    }
  ],
  "id": "claim_4d4dbcfdc8f3c952a341",
  "mentor_id": "mentor_ebb4b086876bdafc6e30",
  "moderation": {
    "decision_at": "2026-08-22T09:49:43Z",
    "mode": "manual",
    "moderator_github_user_id": 107397009,
    "normalized_fields": [
      "organization_id"
    ],
    "policy_version": 1,
    "reason": "GitHub PR merge approval"
  },
  "revocation_reason": null,
  "revoked_at": null,
  "schema_version": 1,
  "status": "accepted",
  "submitted": {
    "email": "guangxuwang@ncu.edu.cn",
    "mentor_status": "active",
    "name": "王光绪",
    "organization_id": null,
    "profile_url": "https://teacher.ncu.edu.cn/publish/091901",
    "recent_papers": [],
    "research_directions": [
      "高光效、高可靠性硅基氮化镓LED芯片器件技术创新与成果转化"
    ],
    "source_url": "https://ie.ncu.edu.cn/szdw/yjszdjs/xxytxgcbsdds.htm",
    "submitted_department": "国家硅基LED工程技术研究中心、南昌实验室",
    "submitted_school": "信息工程学院",
    "submitted_university": "南昌大学",
    "title": "研究员"
  }
}
