{
  "accepted": {
    "email": "buptgx@bupt.edu.cn",
    "mentor_status": "active",
    "name": "高鑫",
    "organization_id": "org_auto_3a89ea1fe1abc4305d65",
    "profile_url": "https://teacher.bupt.edu.cn/gaoxin2/zh_CN/index.htm",
    "recent_papers": [],
    "research_directions": [
      "新型三维光场显示技术、虚拟/增强现实显示技术及其他新型显示技术"
    ],
    "source_url": "https://see.bupt.edu.cn/szdw/fgj/3.htm",
    "submitted_department": "电子工程学院",
    "submitted_school": "电子工程学院",
    "submitted_university": "北京邮电大学",
    "title": "副教授"
  },
  "contributor": {
    "account_age_days_at_submission": 1527,
    "account_created_at": "2022-06-13T08:30:46Z",
    "github_login_at_submission": "JunieXD",
    "github_user_id": 107397009,
    "github_user_type": "User",
    "issue_number": 93,
    "issue_url": "https://github.com/JunieXD/AutoEmailSender-MentorData/issues/93",
    "submitted_at": "2026-08-19T06:59:07Z"
  },
  "evidence": [
    {
      "fields": [
        "name",
        "email",
        "organization_id",
        "title",
        "research_directions",
        "profile_url"
      ],
      "observed_at": "2026-08-19T06:59:07Z",
      "source_url": "https://teacher.bupt.edu.cn/gaoxin2/zh_CN/index.htm"
    }
  ],
  "id": "claim_7a00773cd4f607a331c0",
  "mentor_id": "mentor_cfa6870612990e336e62",
  "moderation": {
    "decision_at": "2026-08-19T07:31:44Z",
    "mode": "manual",
    "moderator_github_user_id": 107397009,
    "normalized_fields": [
      "organization_id"
    ],
    "policy_version": 1,
    "reason": "GitHub PR merge approval"
  },
  "revocation_reason": null,
  "revoked_at": null,
  "schema_version": 1,
  "status": "accepted",
  "submitted": {
    "email": "buptgx@bupt.edu.cn",
    "mentor_status": "active",
    "name": "高鑫",
    "organization_id": null,
    "profile_url": "https://teacher.bupt.edu.cn/gaoxin2/zh_CN/index.htm",
    "recent_papers": [],
    "research_directions": [
      "新型三维光场显示技术、虚拟/增强现实显示技术及其他新型显示技术"
    ],
    "source_url": "https://see.bupt.edu.cn/szdw/fgj/3.htm",
    "submitted_department": "电子工程学院",
    "submitted_school": "电子工程学院",
    "submitted_university": "北京邮电大学",
    "title": "副教授"
  }
}
