{
  "accepted": {
    "email": "yaoye@nwpu.edu.cn",
    "mentor_status": "active",
    "name": "姚烨",
    "organization_id": "org_auto_bc39d2e0b41446b4dc04",
    "profile_url": "http://teacher.nwpu.edu.cn/yaoye.html",
    "recent_papers": [],
    "research_directions": [
      "网络信息系统安全性测评技术,网络软件安全性测试技术,工业互联网及安全技术"
    ],
    "source_url": "https://jsj.nwpu.edu.cn/snew/szdw.htm",
    "submitted_department": "计算机学院",
    "submitted_school": "计算机学院",
    "submitted_university": "西北工业大学",
    "title": "副教授"
  },
  "contributor": {
    "account_age_days_at_submission": 1519,
    "account_created_at": "2022-06-13T08:30:46Z",
    "github_login_at_submission": "JunieXD",
    "github_user_id": 107397009,
    "github_user_type": "User",
    "issue_number": 32,
    "issue_url": "https://github.com/JunieXD/AutoEmailSender-MentorData/issues/32",
    "submitted_at": "2026-08-11T07:13:32Z"
  },
  "evidence": [
    {
      "fields": [
        "name",
        "email",
        "organization_id",
        "title",
        "research_directions",
        "profile_url"
      ],
      "observed_at": "2026-08-11T07:13:32Z",
      "source_url": "http://teacher.nwpu.edu.cn/yaoye.html"
    }
  ],
  "id": "claim_7b3dedbfad0abd3ba25e",
  "mentor_id": "mentor_16acec1d9b65b121a423",
  "moderation": {
    "decision_at": "2026-08-11T07:18:29Z",
    "mode": "manual",
    "moderator_github_user_id": 107397009,
    "normalized_fields": [
      "organization_id"
    ],
    "policy_version": 1,
    "reason": "GitHub PR merge approval"
  },
  "revocation_reason": null,
  "revoked_at": null,
  "schema_version": 1,
  "status": "accepted",
  "submitted": {
    "email": "yaoye@nwpu.edu.cn",
    "mentor_status": "active",
    "name": "姚烨",
    "organization_id": null,
    "profile_url": "http://teacher.nwpu.edu.cn/yaoye.html",
    "recent_papers": [],
    "research_directions": [
      "网络信息系统安全性测评技术,网络软件安全性测试技术,工业互联网及安全技术"
    ],
    "source_url": "https://jsj.nwpu.edu.cn/snew/szdw.htm",
    "submitted_department": "计算机学院",
    "submitted_school": "计算机学院",
    "submitted_university": "西北工业大学",
    "title": "副教授"
  }
}
