{
  "accepted": {
    "email": "yingming.gao@bupt.edu.cn",
    "mentor_status": "active",
    "name": "高迎明",
    "organization_id": "org_auto_518e01d0faf25e995891",
    "profile_url": null,
    "recent_papers": [],
    "research_directions": [
      "语音合成与识别、人机交互、语音信息处理"
    ],
    "source_url": "https://ai.bupt.edu.cn/szdw/szyl/znkxyjsx.htm",
    "submitted_department": "智能科学与技术系",
    "submitted_school": "人工智能学院",
    "submitted_university": "北京邮电大学",
    "title": "讲师"
  },
  "contributor": {
    "account_age_days_at_submission": 1526,
    "account_created_at": "2022-06-13T08:30:46Z",
    "github_login_at_submission": "JunieXD",
    "github_user_id": 107397009,
    "github_user_type": "User",
    "issue_number": 87,
    "issue_url": "https://github.com/JunieXD/AutoEmailSender-MentorData/issues/87",
    "submitted_at": "2026-08-17T10:22:08Z"
  },
  "evidence": [
    {
      "fields": [
        "name",
        "email",
        "organization_id",
        "title",
        "research_directions"
      ],
      "observed_at": "2026-08-17T10:22:08Z",
      "source_url": "https://ai.bupt.edu.cn/szdw/szyl/znkxyjsx.htm"
    }
  ],
  "id": "claim_5dadaaec5b8ff2ca7c27",
  "mentor_id": "mentor_74437dc0cf4dd2641578",
  "moderation": {
    "decision_at": "2026-08-17T11:11:50Z",
    "mode": "manual",
    "moderator_github_user_id": 107397009,
    "normalized_fields": [
      "organization_id"
    ],
    "policy_version": 1,
    "reason": "GitHub PR merge approval"
  },
  "revocation_reason": null,
  "revoked_at": null,
  "schema_version": 1,
  "status": "accepted",
  "submitted": {
    "email": "yingming.gao@bupt.edu.cn",
    "mentor_status": "active",
    "name": "高迎明",
    "organization_id": null,
    "profile_url": null,
    "recent_papers": [],
    "research_directions": [
      "语音合成与识别、人机交互、语音信息处理"
    ],
    "source_url": "https://ai.bupt.edu.cn/szdw/szyl/znkxyjsx.htm",
    "submitted_department": "智能科学与技术系",
    "submitted_school": "人工智能学院",
    "submitted_university": "北京邮电大学",
    "title": "讲师"
  }
}
